{
  "offeringCode": "syncrobrain.telemetry-digest.v1",
  "window": { "start": "2026-09-06T00:00:00.000Z", "end": "2026-09-06T01:00:00.000Z" },
  "projectId": "proj-1",
  "assetCount": 1,
  "sampleCount": 12,
  "series": [{ "key": "temperature", "min": 2.1, "max": 7.8, "avg": 4.4, "n": 12 }],
  "digestSha256": "aaaaaaaaaaaaaaaaaaaaaaaaaaaaaaaaaaaaaaaaaaaaaaaaaaaaaaaaaaaaaaaa",
  "ref": "sb:digest:aaaaaaaaaaaaaaaaaaaaaaaa"
}
